<?xml version="1.0" encoding="UTF-8"?>
<rules xmlns="http://www.mmarini.org/fuzzy" xmlns:xsi="http://www.w3.org/2001/XMLSchema-instance"
	xsi:schemaLocation="http://www.mmarini.org/fuzzy rules.xsd">
	<rule>
		<if>
			<or>
				<predicate>peli</predicate>
				<predicate>latte</predicate>
			</or>
		</if>
		<then>
			<assign>mammifero</assign>
		</then>
	</rule>

	<rule>
		<if>
			<or>
				<predicate>piume</predicate>
				<and>
					<predicate>vola</predicate>
					<predicate>uova</predicate>
				</and>
			</or>
		</if>
		<then>
			<assign>uccello</assign>
		</then>
	</rule>

	<rule>
		<if>
			<or>
				<predicate>carne</predicate>
				<and>
					<predicate>denti</predicate>
					<predicate>occhi</predicate>
					<predicate>artigli</predicate>
				</and>
			</or>
		</if>
		<then>
			<assign>carnivoro</assign>
		</then>
	</rule>

	<rule>
		<if>
			<or>
				<and>
					<predicate>mammifero</predicate>
					<predicate>zoccoli</predicate>
				</and>
				<and>
					<predicate>mammifero</predicate>
					<predicate>ruminante</predicate>
				</and>
			</or>
		</if>
		<then>
			<assign>ungulato</assign>
		</then>
	</rule>

	<rule>
		<if>
			<and>
				<predicate>mammifero</predicate>
				<predicate>carnivoro</predicate>
				<predicate>fulvo</predicate>
				<predicate>macchie</predicate>
			</and>
		</if>
		<then>
			<assign>ghepardo</assign>
		</then>
	</rule>

	<rule>
		<if>
			<and>
				<predicate>mammifero</predicate>
				<predicate>carnivoro</predicate>
				<predicate>fulvo</predicate>
				<predicate>strisce</predicate>
			</and>
		</if>
		<then>
			<assign>tigre</assign>
		</then>
	</rule>

	<rule>
		<if>
			<and>
				<predicate>macchie</predicate>
				<predicate>zampe</predicate>
				<predicate>ungulato</predicate>
				<predicate>collo</predicate>
			</and>
		</if>
		<then>
			<assign>giraffa</assign>
		</then>
	</rule>

	<rule>
		<if>
			<and>
				<predicate>strisce</predicate>
				<predicate>ungulato</predicate>
			</and>
		</if>
		<then>
			<assign>zebra</assign>
		</then>
	</rule>

	<rule>
		<if>
			<and>
				<predicate>collo</predicate>
				<predicate>uccello</predicate>
				<predicate>bianconero</predicate>
				<not>
					<predicate>vola</predicate>
				</not>
			</and>
		</if>
		<then>
			<assign>struzzo</assign>
		</then>
	</rule>

	<rule>
		<if>
			<and>
				<not>
					<predicate>vola</predicate>
				</not>
				<predicate>uccello</predicate>
				<predicate>nuota</predicate>
			</and>
		</if>
		<then>
			<assign>pinguino</assign>
		</then>
	</rule>

	<rule>
		<if>
			<and>
				<predicate>vola</predicate>
				<predicate>uccello</predicate>
			</and>
		</if>
		<then>
			<assign>albatro</assign>
		</then>
	</rule>
</rules>